{
  "$schema": "https://json-schema.org/draft/2020-12/schema",
  "title": "Theoretical Positioning Output",
  "type": "object",
  "required": [
    "status",
    "module_id",
    "module_name",
    "input_summary",
    "structured_output",
    "next_input",
    "assumptions",
    "uncertainty_log",
    "evidence_requirements",
    "reviewer_risks",
    "revision_hooks",
    "trace_context"
  ],
  "properties": {
    "schema_version": {
      "type": "string"
    },
    "project_id": {
      "type": "string"
    },
    "status": {
      "$ref": "#/$defs/status"
    },
    "module_id": {
      "const": "03_theoretical_positioning"
    },
    "module_name": {
      "const": "Theoretical Positioning"
    },
    "input_summary": {
      "$ref": "#/$defs/input_summary"
    },
    "structured_output": {
      "type": "object",
      "required": [
        "problem_class",
        "formal_problem_elements",
        "decision_variables",
        "objective_functions",
        "constraints",
        "complexity_sources",
        "coupling_mechanisms",
        "method_implications",
        "theory_to_contribution_bridge"
      ],
      "properties": {
        "problem_class": {
          "type": "array",
          "items": {
            "$ref": "#/$defs/evidence_item"
          }
        },
        "formal_problem_elements": {
          "type": "object",
          "required": [
            "decision_space",
            "objective_space",
            "constraint_space",
            "coupling_structure",
            "evaluation_cost",
            "search_difficulty"
          ],
          "properties": {
            "decision_space": {
              "type": "string"
            },
            "objective_space": {
              "type": "string"
            },
            "constraint_space": {
              "type": "string"
            },
            "coupling_structure": {
              "type": "string"
            },
            "evaluation_cost": {
              "type": "string"
            },
            "search_difficulty": {
              "type": "string"
            }
          },
          "additionalProperties": false
        },
        "decision_variables": {
          "type": "array",
          "items": {
            "$ref": "#/$defs/evidence_item"
          }
        },
        "objective_functions": {
          "type": "array",
          "items": {
            "$ref": "#/$defs/evidence_item"
          }
        },
        "constraints": {
          "type": "array",
          "items": {
            "$ref": "#/$defs/evidence_item"
          }
        },
        "complexity_sources": {
          "type": "array",
          "items": {
            "$ref": "#/$defs/evidence_item"
          }
        },
        "coupling_mechanisms": {
          "type": "array",
          "items": {
            "$ref": "#/$defs/evidence_item"
          }
        },
        "method_implications": {
          "type": "array",
          "items": {
            "type": "object",
            "required": [
              "problem_property",
              "algorithm_requirement",
              "possible_mechanism",
              "evidence_needed",
              "evidence_status"
            ],
            "properties": {
              "problem_property": {
                "type": "string"
              },
              "algorithm_requirement": {
                "type": "string"
              },
              "possible_mechanism": {
                "type": "string"
              },
              "evidence_needed": {
                "type": "string"
              },
              "evidence_status": {
                "$ref": "#/$defs/evidence_status"
              }
            },
            "additionalProperties": false
          }
        },
        "theory_to_contribution_bridge": {
          "type": "array",
          "items": {
            "$ref": "#/$defs/evidence_item"
          }
        },
        "evidence_requirements": {
          "type": "array"
        },
        "uncertainty_log": {
          "type": "array"
        }
      },
      "additionalProperties": false
    },
    "next_input": {
      "type": "object",
      "required": [
        "selected_problem",
        "problem_class",
        "problem_properties",
        "method_implications",
        "theory_to_contribution_bridge",
        "contribution_design_targets",
        "evidence_policy",
        "trace_context"
      ],
      "properties": {
        "selected_problem": {
          "type": "object"
        },
        "problem_class": {
          "type": "array"
        },
        "problem_properties": {
          "type": "array"
        },
        "method_implications": {
          "type": "array"
        },
        "theory_to_contribution_bridge": {
          "type": "array"
        },
        "contribution_design_targets": {
          "type": "array"
        },
        "evidence_policy": {
          "$ref": "#/$defs/evidence_policy"
        },
        "trace_context": {
          "$ref": "#/$defs/trace_context"
        },
        "evidence_context": {
          "type": "object",
          "required": [
            "corpus_id",
            "corpus_scope",
            "paper_count",
            "key_grounded_claims",
            "candidate_gap_claims",
            "counterevidence_summary",
            "claims_requiring_verification",
            "evidence_policy",
            "trace_context"
          ],
          "properties": {
            "corpus_id": {
              "type": "string"
            },
            "corpus_scope": {
              "type": "string"
            },
            "paper_count": {
              "type": "integer"
            },
            "key_grounded_claims": {
              "type": "array",
              "items": {
                "type": "object",
                "required": [
                  "claim_id",
                  "grounding_status",
                  "linked_evidence_ids"
                ],
                "properties": {
                  "claim_id": {
                    "type": "string"
                  },
                  "claim_type": {
                    "enum": [
                      "bibliographic_fact",
                      "domain_fact",
                      "method_classification",
                      "objective_classification",
                      "constraint_classification",
                      "limitation_claim",
                      "gap_claim",
                      "problem_importance_claim",
                      "theory_positioning_claim",
                      "contribution_claim",
                      "validation_requirement",
                      "baseline_requirement",
                      "reviewer_risk_claim"
                    ]
                  },
                  "claim_scope": {
                    "enum": [
                      "corpus_scoped",
                      "project_scoped",
                      "field_general",
                      "speculative",
                      "user_provided_scope"
                    ]
                  },
                  "grounding_status": {
                    "enum": [
                      "grounded",
                      "partially_grounded",
                      "ungrounded",
                      "contradicted",
                      "needs_literature_verification",
                      "corpus_scoped_only"
                    ]
                  },
                  "support_strength": {
                    "enum": [
                      "direct",
                      "indirect",
                      "weak",
                      "contradictory",
                      "contextual",
                      "not_applicable"
                    ]
                  },
                  "linked_paper_ids": {
                    "type": "array",
                    "items": {
                      "type": "string"
                    }
                  },
                  "linked_evidence_ids": {
                    "type": "array",
                    "items": {
                      "type": "string"
                    }
                  },
                  "safer_wording": {
                    "type": [
                      "string",
                      "null"
                    ]
                  },
                  "limitations": {
                    "type": [
                      "string",
                      "null"
                    ]
                  }
                },
                "additionalProperties": false
              }
            },
            "candidate_gap_claims": {
              "type": "array",
              "items": {
                "type": "object",
                "required": [
                  "gap_id",
                  "corpus_scope",
                  "grounding_status",
                  "supporting_evidence_ids",
                  "contradicting_evidence_ids"
                ],
                "properties": {
                  "gap_id": {
                    "type": "string"
                  },
                  "corpus_scope": {
                    "type": "string"
                  },
                  "grounding_status": {
                    "enum": [
                      "grounded",
                      "partially_grounded",
                      "ungrounded",
                      "contradicted",
                      "needs_literature_verification",
                      "corpus_scoped_only"
                    ]
                  },
                  "supporting_evidence_ids": {
                    "type": "array",
                    "items": {
                      "type": "string"
                    }
                  },
                  "contradicting_evidence_ids": {
                    "type": "array",
                    "items": {
                      "type": "string"
                    }
                  },
                  "novelty_risk": {
                    "type": [
                      "string",
                      "null"
                    ]
                  },
                  "safer_gap_wording": {
                    "type": [
                      "string",
                      "null"
                    ]
                  }
                },
                "additionalProperties": false
              }
            },
            "counterevidence_summary": {
              "type": "array",
              "items": {
                "type": "object"
              }
            },
            "claims_requiring_verification": {
              "type": "array"
            },
            "evidence_policy": {
              "type": "object"
            },
            "trace_context": {
              "type": "object"
            }
          },
          "additionalProperties": false
        }
      },
      "additionalProperties": false
    },
    "assumptions": {
      "type": "array",
      "items": {
        "$ref": "#/$defs/evidence_item"
      }
    },
    "uncertainty_log": {
      "type": "array",
      "items": {
        "$ref": "#/$defs/uncertainty_item"
      }
    },
    "evidence_requirements": {
      "type": "array",
      "items": {
        "$ref": "#/$defs/evidence_requirement"
      }
    },
    "reviewer_risks": {
      "type": "array",
      "items": {
        "$ref": "#/$defs/reviewer_risk"
      }
    },
    "revision_hooks": {
      "type": "array",
      "items": {
        "$ref": "#/$defs/revision_hook"
      }
    },
    "trace_context": {
      "$ref": "#/$defs/trace_context"
    },
    "evidence_links": {
      "type": "array",
      "items": {
        "type": "object",
        "required": [
          "evidence_id",
          "support_strength"
        ],
        "properties": {
          "evidence_id": {
            "type": "string"
          },
          "claim_id": {
            "type": "string"
          },
          "paper_id": {
            "type": "string"
          },
          "support_strength": {
            "enum": [
              "direct",
              "indirect",
              "weak",
              "contradictory",
              "contextual",
              "not_applicable"
            ]
          },
          "source_field": {
            "type": [
              "string",
              "null"
            ]
          }
        },
        "additionalProperties": false
      }
    },
    "grounded_claims": {
      "type": "array",
      "items": {
        "type": "object",
        "required": [
          "claim_id",
          "grounding_status"
        ],
        "properties": {
          "claim_id": {
            "type": "string"
          },
          "claim_text": {
            "type": "string"
          },
          "grounding_status": {
            "enum": [
              "grounded",
              "partially_grounded",
              "ungrounded",
              "contradicted",
              "needs_literature_verification",
              "corpus_scoped_only"
            ]
          },
          "linked_evidence_ids": {
            "type": "array",
            "items": {
              "type": "string"
            }
          },
          "corpus_scope": {
            "type": [
              "string",
              "null"
            ]
          }
        },
        "additionalProperties": false
      }
    },
    "grounding_summary": {
      "type": "object",
      "properties": {
        "grounded_count": {
          "type": "integer"
        },
        "needs_literature_verification_count": {
          "type": "integer"
        },
        "unsupported_verified_count": {
          "type": "integer"
        },
        "summary": {
          "type": "string"
        }
      },
      "additionalProperties": false
    },
    "corpus_scope": {
      "type": [
        "string",
        "null"
      ]
    },
    "counterevidence": {
      "type": "array",
      "items": {
        "type": "object",
        "properties": {
          "claim_id": {
            "type": "string"
          },
          "evidence_id": {
            "type": "string"
          },
          "impact": {
            "type": "string"
          },
          "safer_reformulation": {
            "type": "string"
          }
        },
        "additionalProperties": false
      }
    },
    "claim_grounding_risks": {
      "type": "array",
      "items": {
        "type": "object",
        "required": [
          "risk",
          "severity"
        ],
        "properties": {
          "risk": {
            "type": "string"
          },
          "severity": {
            "enum": [
              "low",
              "medium",
              "high"
            ]
          },
          "required_action": {
            "type": "string"
          }
        },
        "additionalProperties": false
      }
    }
  },
  "additionalProperties": false,
  "$defs": {
    "status": {
      "enum": [
        "draft",
        "complete",
        "validated",
        "needs_revision"
      ]
    },
    "evidence_status": {
      "enum": [
        "verified",
        "user_provided",
        "inferred",
        "needs_literature_verification",
        "speculative"
      ]
    },
    "evidence_item": {
      "type": "object",
      "required": [
        "statement",
        "evidence_status"
      ],
      "properties": {
        "id": {
          "type": "string"
        },
        "statement": {
          "type": "string"
        },
        "evidence_status": {
          "$ref": "#/$defs/evidence_status"
        },
        "source": {
          "type": "string"
        }
      },
      "additionalProperties": false
    },
    "input_summary": {
      "type": "object",
      "required": [
        "direct_upstream_module_id",
        "summary"
      ],
      "properties": {
        "direct_upstream_module_id": {
          "type": [
            "string",
            "null"
          ]
        },
        "summary": {
          "type": "string"
        },
        "consumed_files": {
          "type": "array",
          "items": {
            "type": "string"
          }
        }
      },
      "additionalProperties": false
    },
    "evidence_policy": {
      "type": "object",
      "required": [
        "default_literature_status",
        "allowed_statuses"
      ],
      "properties": {
        "default_literature_status": {
          "const": "needs_literature_verification"
        },
        "allowed_statuses": {
          "type": "array",
          "items": {
            "$ref": "#/$defs/evidence_status"
          }
        }
      },
      "additionalProperties": false
    },
    "trace_context": {
      "type": "object",
      "required": [
        "source_module_ids",
        "domain_tension_ids",
        "problem_ids",
        "theory_element_ids",
        "contribution_ids",
        "lineage"
      ],
      "properties": {
        "source_module_ids": {
          "type": "array",
          "items": {
            "type": "string"
          }
        },
        "domain_tension_ids": {
          "type": "array",
          "items": {
            "type": "string"
          }
        },
        "problem_ids": {
          "type": "array",
          "items": {
            "type": "string"
          }
        },
        "theory_element_ids": {
          "type": "array",
          "items": {
            "type": "string"
          }
        },
        "contribution_ids": {
          "type": "array",
          "items": {
            "type": "string"
          }
        },
        "lineage": {
          "type": "array",
          "items": {
            "type": "object"
          }
        }
      },
      "additionalProperties": false
    },
    "uncertainty_item": {
      "type": "object",
      "required": [
        "item",
        "evidence_status",
        "action_required"
      ],
      "properties": {
        "item": {
          "type": "string"
        },
        "evidence_status": {
          "$ref": "#/$defs/evidence_status"
        },
        "action_required": {
          "type": "string"
        }
      },
      "additionalProperties": false
    },
    "evidence_requirement": {
      "type": "object",
      "required": [
        "requirement_id",
        "requirement",
        "evidence_status"
      ],
      "properties": {
        "requirement_id": {
          "type": "string"
        },
        "requirement": {
          "type": "string"
        },
        "evidence_status": {
          "$ref": "#/$defs/evidence_status"
        }
      },
      "additionalProperties": false
    },
    "reviewer_risk": {
      "type": "object",
      "required": [
        "risk_id",
        "question",
        "mitigation",
        "evidence_status"
      ],
      "properties": {
        "risk_id": {
          "type": "string"
        },
        "question": {
          "type": "string"
        },
        "mitigation": {
          "type": "string"
        },
        "evidence_status": {
          "$ref": "#/$defs/evidence_status"
        }
      },
      "additionalProperties": false
    },
    "revision_hook": {
      "type": "object",
      "required": [
        "field",
        "action",
        "affects"
      ],
      "properties": {
        "field": {
          "type": "string"
        },
        "action": {
          "type": "string"
        },
        "affects": {
          "type": "array",
          "items": {
            "type": "string"
          }
        }
      },
      "additionalProperties": false
    }
  }
}
